{"id":"api.read_release_status","version":"1.0","purpose":"Read release status from one approved API","capabilities":["read","network_read","secret_read"],"side_effects":[],"inputs":{"release_id":"string"},"outputs":{"status":"string"},"preconditions":["secret handle and release are in task scope"],"postconditions":["response contains the requested release ID"],"target_scope":{"class":"service","identifiers":["releases.example.test"]},"auth_source":"provider-managed secret handle RELEASES_API_TOKEN","network_destinations":["https://releases.example.test"],"data_classes":["public release metadata"],"idempotent":true,"retry":{"max_attempts":2},"cancellation":"abort request and discard partial response","evidence":["release ID","response status","redacted request ID"]}
