{"id":"repo.write_scoped_file","version":"1.0","purpose":"Write one text file below an approved repository path","capabilities":["repo_write"],"side_effects":["repository content changes"],"inputs":{"path":"string","content":"string"},"outputs":{"commit":"string"},"preconditions":["repository and path prefix are approved"],"postconditions":["changed paths stay below docs/"],"target_scope":{"class":"repository","identifiers":["synthetic/example:docs/"]},"auth_source":"provider-managed repository token","network_destinations":["https://github.com"],"data_classes":["public"],"idempotent":false,"retry":{"max_attempts":1},"cancellation":"stop before commit creation; report any staged file","evidence":["commit SHA","changed-file list"]}
