{"id":"search.public_docs","version":"1.0","purpose":"Search an approved public documentation index","capabilities":["read","network_read"],"side_effects":[],"inputs":{"query":"string"},"outputs":{"results":"array"},"preconditions":["documentation host is approved"],"postconditions":["results include source URLs"],"target_scope":{"class":"service","identifiers":["docs.example.test"]},"auth_source":"none","network_destinations":["https://docs.example.test"],"data_classes":["public"],"idempotent":true,"retry":{"max_attempts":2},"cancellation":"abort the in-flight HTTP request","evidence":["source URLs","response status"]}
