{"id":"message.send_incident_update","version":"1.0","purpose":"Send one incident update to an approved channel","capabilities":["external_write"],"side_effects":["message becomes visible to channel members"],"inputs":{"channel_id":"string","body":"string","idempotency_key":"string"},"outputs":{"message_id":"string"},"preconditions":["channel and message body are approved"],"postconditions":["one message exists with the idempotency key"],"target_scope":{"class":"service","identifiers":["synthetic-workspace:incident-updates"]},"auth_source":"provider-managed messaging connection","network_destinations":["https://messaging.example.test"],"data_classes":["public","synthetic"],"idempotent":true,"retry":{"max_attempts":2},"cancellation":"prevent unsent retries and report an already-created message","evidence":["message ID","channel ID","idempotency key"]}
